問題文,答え,メモ,ジャンル,難易度,タグ
2015年の国連サミットで193カ国が採択した「2030アジェンダ」の中心となる目標で、貧困・ジェンダー平等・気候変動対策など17の国際目標を含む取り組みの略称は何でしょう？,SDGs,「Sustainable Development Goals」の略。2030年までの達成を目指す。,社会,3,"短文基本,社会,国連,環境"
ソクラテスに師事してその思想を対話篇に記録し、アテネ郊外に哲学学校「アカデメイア」を開設してアリストテレスを育てた古代ギリシャの哲学者で、「イデア論」を唱えた人物は誰でしょう？,プラトン,ソクラテスの弟子、アリストテレスの師。アカデメイア設立。,文系学問,4,"短文基本,哲学,古代ギリシャ,人物"
オリンピックで100m・200m・4×100mリレーの3種目を3大会連続で制するという史上初の偉業を達成し、「世界最速の男」の称号を持つジャマイカの陸上選手は誰でしょう？,ウサイン・ボルト（ボルト）,2008北京・2012ロンドン・2016リオで100m・200m・リレー3冠を達成。,スポーツ,3,"短文基本,陸上,オリンピック,短距離"
阪急電鉄の創業者・小林一三（こばやしいちぞう）が1914年に設立し、女性のみで構成され男役と娘役に分かれて上演する、現在も兵庫県宝塚市に本拠を置く歌劇団は何でしょう？,宝塚歌劇団,1914年設立。女性のみの歌劇団。本拠地は兵庫県宝塚市。,芸能,3,"短文基本,芸能,舞台,歌劇"
ヴェゲナーの大陸移動説を発展させて1960年代に確立した地球科学理論で、地球表面が十数枚の硬い岩盤（プレート）で覆われており、それらの移動・衝突・分離が火山活動・地震・造山運動の原因となるとする理論を何というでしょう？,プレートテクトニクス,海洋底拡大説（ヘスとディーツ）を統合して成立した理論。,理系学問,5,"短文基本,地学,地球科学,理論"
ロジャー・フェデラー、ノバク・ジョコビッチとともにテニス界の「ビッグ3」を形成し、赤土のコートで行われる全仏オープンに14回優勝して「クレーの王者」の異名をとったスペインの選手は誰でしょう？,ラファエル・ナダル（ナダル）,全仏オープン14回優勝。「クレーの王者」と呼ばれる。,スポーツ,4,"短文基本,テニス,グランドスラム,スペイン"
古代インドで「空」を意味する「シューニャ」として生まれ、アラビア数学を経てヨーロッパに伝わった際に単なる位取り記号から数として認識されるようになった、任意の数に足しても値が変わらない性質を持つ数は何でしょう？,ゼロ（0）,インドのブラーマグプタが演算ルールを整備。アラビア経由でヨーロッパへ。,ノンジャンル,4,"短文基本,数学,歴史,概念"
「アタリショック」後の北米家庭用ゲーム市場を立て直したとも評価される作品で、ファミコン向けに1985年に発売され、マリオがクッパに拐（さら）われたピーチ姫を救う横スクロールアクションゲームは何でしょう？,スーパーマリオブラザーズ,北米ではNESとして発売。アタリショック後の市場回復に貢献したとされる。,アニメ&ゲーム,3,"短文基本,ゲーム,任天堂,アクション"
品質に問題はないが廃棄される食品を企業・農家・個人から寄付として集め、食料を必要とする生活困窮者や施設に無償で提供する非営利活動の仕組みを、食料と金融機関の名前を組み合わせた言葉で何というでしょう？,フードバンク,1960年代にアメリカで始まった運動。日本でも広まっている。,社会,4,"短文基本,社会,食品,非営利"
「目的のためには手段を選ばない」という解釈でも知られ、道徳や宗教倫理を超えた政治的実利を優先して権力を維持すべきとする思想で、ルネサンス期フィレンツェの外交官が著した『君主論』を源流に持つとされる政治哲学の概念を何というでしょう？,マキャヴェリズム,マキャヴェッリ（1469-1527）の著作『君主論』(1532年出版)に由来。,文系学問,5,"短文基本,哲学,政治思想,ルネサンス"
19世紀のクリケットで1人の投手が3球連続で打者を退場させると観客から帽子を贈られた慣習に語源が求められるとされ、サッカーなどで1人の選手が同一試合内に3得点以上する快挙に使われる言葉は何でしょう？,ハットトリック,語源はクリケット（諸説あり）。サッカーでは特に有名な用語。,スポーツ,4,"短文基本,スポーツ,サッカー,用語"
チラコイドでの光反応とカルビン回路による暗反応という2段階で構成され、植物や藻類が光エネルギーを使って二酸化炭素と水から糖類を合成する、生命の根幹を支える代謝プロセスを何というでしょう？,光合成,真核生物の植物は葉緑体で行う。酸素が副産物として放出される。,理系学問,3,"短文基本,生物,植物,代謝"
タンザニア・ザンジバル島出身のインド系パルシー家庭に生まれ、ロックバンド「クイーン」のリードボーカルとして「ボヘミアン・ラプソディ」「ウィ・ウィル・ロック・ユー」などを世に送り出したが、1991年にエイズ関連疾患で45歳にして世を去ったミュージシャンは誰でしょう？,フレディ・マーキュリー,1991年11月24日没。ザンジバル生まれのインド系パルシー教徒。,芸能,5,"短文基本,音楽,ロック,クイーン"
19世紀後半にポーランドの眼科医ルドヴィコ・ラザロ・ザメンホフが、民族・国家を超えた国際共通語として考案した人工言語で、「希望をもたらす者（エスペランタ）」を意味する名称を持ち、現在も世界に数百万の話者がいるとされる言語は何でしょう？,エスペラント,1887年にザメンホフが発表。現存する人工言語の中で最も普及している。,ノンジャンル,6,"短文基本,言語,文化,国際"
ドラゴンクエストシリーズのキャラクターデザインを担当した鳥山明（とりやまあきら）が創り出し、青いゼリー状の体と丸くつぶらな目を持つ、シリーズ全作品に登場するシンボル的な弱い敵キャラクターは何でしょう？,スライム,ドラクエシリーズの象徴。鳥山明デザイン。弱いが愛着のある存在として定着。,アニメ&ゲーム,4,"短文基本,ゲーム,ドラクエ,モンスター"
ヘブライ語で「安息（あんそく）」という意味の言葉に由来し、もともとは大学の教員が研究に専念するために定期的に授業を免除される制度を指していたが、近年は企業が従業員に与える長期の有給休暇や自己研鑽（じこけんさん）期間にも使われるようになった言葉は何でしょう？,サバティカル,ヘブライ語「シャバット（安息）」に由来。大学制度が起源。,ライフスタイル,5,"短文基本,ライフスタイル,働き方,教育"
1215年にイングランド王ジョン1世が貴族の強制によって署名した文書で、国王の恣意的な課税や逮捕を制限し、法の支配の原則を定めた近代立憲主義の源流ともされる文書はラテン語で「大憲章」を意味する何でしょう？,マグナカルタ,1215年6月15日、ラニーミードでジョン王が署名。近代民主主義の礎ともされる。,文系学問,5,"短文基本,歴史,イギリス,法律"
もともとフランス宮廷で食器・飲食物の管理を担う役職に由来し、現在では飲食店でワインの適切な保存・サービスや料理との相性（マリアージュ）のアドバイスを行う専門家を指す職種名は何でしょう？,ソムリエ,フランス宮廷の「侍従」が語源。日本ではソムリエール（女性）と区別する場合もある。,ライフスタイル,4,"短文基本,ライフスタイル,グルメ,ワイン"
1980年にオランダ・ハーグの国際私法会議で採択され、親権紛争による国境をまたいだ子供の連れ去りに対して、元の居住国への原則返還を締約国に義務づけた子の保護に関する条約の通称は何でしょう？,ハーグ条約,正式名称「国際的な子の奪取の民事上の側面に関する条約」。日本は2013年加盟。,社会,6,"短文基本,社会,国際法,条約"
スクウェアが当初NINTENDO64向けに開発していたが最終的にソニーのPlayStationで1997年に発売し、主人公・クラウド・ストライフが環境テロ組織アバランチとともに魔晄炉（まこうろ）を爆破するところから始まる人気RPGシリーズの第7作は何でしょう？,ファイナルファンタジーVII（FF7）,1997年1月31日PS版発売（日本）。FF史上初の3DCGムービーを採用。,アニメ&ゲーム,5,"短文基本,ゲーム,スクウェア,RPG"
